{
  "engine_version": "MDTraj 1.11.1; MDAnalysis 2.10.0",
  "job_id": "trajectory_features_smoke",
  "primitive_execution_only": true,
  "python_owns_final_score": false,
  "python_owns_report_semantics": false,
  "schema_version": "phase_0_8_5",
  "status": "PASS",
  "worker": "trajectory_features"
}
